Name,Description,Range,Increment,Value,Read_only
COMPASS_ORIENT2,"The orientation of a second external compass relative to the vehicle frame. This value will be ignored unless this compass is set as an external compass. When set correctly in the northern hemisphere, pointing the nose and right side down should increase the MagX and MagY values respectively. Rolling the vehicle upside down should decrease the MagZ value. For southern hemisphere, switch increase and decrease. NOTE: For internal compasses, AHRS_ORIENT is used.",,,0|1|2|3|4|5|6|7|8|9|10|11|12|13|14|15|16|17|18|19|20|21|22|23|24|25|26|27|28|29|30|31|32|33|34|35|36|37|38|39|40|42|43|100|101|102|,
COMPASS_EXTERN2,Configure second compass so it is attached externally. This is auto-detected on most boards. If set to 0 or 1 then auto-detection by bus connection can override the value. If set to 2 then auto-detection will be disabled.,,,0|1|2|,
COMPASS_USE3,Enable or disable the tertiary compass for determining heading.,,,0|1|,
COMPASS_ORIENT3,"The orientation of a third external compass relative to the vehicle frame. This value will be ignored unless this compass is set as an external compass. When set correctly in the northern hemisphere, pointing the nose and right side down should increase the MagX and MagY values respectively. Rolling the vehicle upside down should decrease the MagZ value. For southern hemisphere, switch increase and decrease. NOTE: For internal compasses, AHRS_ORIENT is used.",,,0|1|2|3|4|5|6|7|8|9|10|11|12|13|14|15|16|17|18|19|20|21|22|23|24|25|26|27|28|29|30|31|32|33|34|35|36|37|38|39|40|42|43|100|101|102|,
COMPASS_EXTERN3,Configure third compass so it is attached externally. This is auto-detected on most boards. If set to 0 or 1 then auto-detection by bus connection can override the value. If set to 2 then auto-detection will be disabled.,,,0|1|2|,
COMPASS_DIA_X,"DIA_X in the compass soft-iron calibration matrix: [[DIA_X, ODI_X, ODI_Y], [ODI_X, DIA_Y, ODI_Z], [ODI_Y, ODI_Z, DIA_Z]]",,,,
COMPASS_DIA_Y,"DIA_Y in the compass soft-iron calibration matrix: [[DIA_X, ODI_X, ODI_Y], [ODI_X, DIA_Y, ODI_Z], [ODI_Y, ODI_Z, DIA_Z]]",,,,
COMPASS_DIA_Z,"DIA_Z in the compass soft-iron calibration matrix: [[DIA_X, ODI_X, ODI_Y], [ODI_X, DIA_Y, ODI_Z], [ODI_Y, ODI_Z, DIA_Z]]",,,,
COMPASS_ODI_X,"ODI_X in the compass soft-iron calibration matrix: [[DIA_X, ODI_X, ODI_Y], [ODI_X, DIA_Y, ODI_Z], [ODI_Y, ODI_Z, DIA_Z]]",,,,
COMPASS_ODI_Y,"ODI_Y in the compass soft-iron calibration matrix: [[DIA_X, ODI_X, ODI_Y], [ODI_X, DIA_Y, ODI_Z], [ODI_Y, ODI_Z, DIA_Z]]",,,,
COMPASS_ODI_Z,"ODI_Z in the compass soft-iron calibration matrix: [[DIA_X, ODI_X, ODI_Y], [ODI_X, DIA_Y, ODI_Z], [ODI_Y, ODI_Z, DIA_Z]]",,,,
COMPASS_DIA2_X,"DIA_X in the compass2 soft-iron calibration matrix: [[DIA_X, ODI_X, ODI_Y], [ODI_X, DIA_Y, ODI_Z], [ODI_Y, ODI_Z, DIA_Z]]",,,,
COMPASS_DIA2_Y,"DIA_Y in the compass2 soft-iron calibration matrix: [[DIA_X, ODI_X, ODI_Y], [ODI_X, DIA_Y, ODI_Z], [ODI_Y, ODI_Z, DIA_Z]]",,,,
COMPASS_DIA2_Z,"DIA_Z in the compass2 soft-iron calibration matrix: [[DIA_X, ODI_X, ODI_Y], [ODI_X, DIA_Y, ODI_Z], [ODI_Y, ODI_Z, DIA_Z]]",,,,
COMPASS_ODI2_X,"ODI_X in the compass2 soft-iron calibration matrix: [[DIA_X, ODI_X, ODI_Y], [ODI_X, DIA_Y, ODI_Z], [ODI_Y, ODI_Z, DIA_Z]]",,,,
COMPASS_ODI2_Y,"ODI_Y in the compass2 soft-iron calibration matrix: [[DIA_X, ODI_X, ODI_Y], [ODI_X, DIA_Y, ODI_Z], [ODI_Y, ODI_Z, DIA_Z]]",,,,
COMPASS_ODI2_Z,"ODI_Z in the compass2 soft-iron calibration matrix: [[DIA_X, ODI_X, ODI_Y], [ODI_X, DIA_Y, ODI_Z], [ODI_Y, ODI_Z, DIA_Z]]",,,,
COMPASS_DIA3_X,"DIA_X in the compass3 soft-iron calibration matrix: [[DIA_X, ODI_X, ODI_Y], [ODI_X, DIA_Y, ODI_Z], [ODI_Y, ODI_Z, DIA_Z]]",,,,
COMPASS_DIA3_Y,"DIA_Y in the compass3 soft-iron calibration matrix: [[DIA_X, ODI_X, ODI_Y], [ODI_X, DIA_Y, ODI_Z], [ODI_Y, ODI_Z, DIA_Z]]",,,,
COMPASS_DIA3_Z,"DIA_Z in the compass3 soft-iron calibration matrix: [[DIA_X, ODI_X, ODI_Y], [ODI_X, DIA_Y, ODI_Z], [ODI_Y, ODI_Z, DIA_Z]]",,,,
COMPASS_ODI3_X,"ODI_X in the compass3 soft-iron calibration matrix: [[DIA_X, ODI_X, ODI_Y], [ODI_X, DIA_Y, ODI_Z], [ODI_Y, ODI_Z, DIA_Z]]",,,,
COMPASS_ODI3_Y,"ODI_Y in the compass3 soft-iron calibration matrix: [[DIA_X, ODI_X, ODI_Y], [ODI_X, DIA_Y, ODI_Z], [ODI_Y, ODI_Z, DIA_Z]]",,,,
COMPASS_ODI3_Z,"ODI_Z in the compass3 soft-iron calibration matrix: [[DIA_X, ODI_X, ODI_Y], [ODI_X, DIA_Y, ODI_Z], [ODI_Y, ODI_Z, DIA_Z]]",,,,
COMPASS_CAL_FIT,This controls the fitness level required for a successful compass calibration. A lower value makes for a stricter fit (less likely to pass). This is the value used for the primary magnetometer. Other magnetometers get double the value.,4 32,0.1,4|8|16|32|,
COMPASS_OFFS_MAX,This sets the maximum allowed compass offset in calibration and arming checks,500 3000,1,,
COMPASS_TYPEMASK,This is a bitmask of driver types to disable. If a driver type is set in this mask then that driver will not try to find a sensor at startup,,,,
COMPASS_FLTR_RNG,This sets the range around the average value that new samples must be within to be accepted. This can help reduce the impact of noise on sensors that are on long I2C cables. The value is a percentage from the average value. A value of zero disables this filter.,0 100,1,,
COMPASS_AUTO_ROT,When enabled this will automatically check the orientation of compasses on successful completion of compass calibration. If set to 2 then external compasses will have their orientation automatically corrected.,,,0|1|2|3|,
COMPASS_PRIO1_ID,"Compass device id with 1st order priority, set automatically if 0. Reboot required after change.",,,,
COMPASS_PRIO2_ID,"Compass device id with 2nd order priority, set automatically if 0. Reboot required after change.",,,,
COMPASS_PRIO3_ID,"Compass device id with 3rd order priority, set automatically if 0. Reboot required after change.",,,,
COMPASS_ENABLE,"Setting this to Enabled(1) will enable the compass. Setting this to Disabled(0) will disable the compass. Note that this is separate from COMPASS_USE. This will enable the low level senor, and will enable logging of magnetometer data. To use the compass for navigation you must also set COMPASS_USE to 1.",,,0|1|,
COMPASS_SCALE,Scaling factor for first compass to compensate for sensor scaling errors. If this is 0 then no scaling is done,0 1.3,,,
COMPASS_SCALE2,Scaling factor for 2nd compass to compensate for sensor scaling errors. If this is 0 then no scaling is done,0 1.3,,,
COMPASS_SCALE3,Scaling factor for 3rd compass to compensate for sensor scaling errors. If this is 0 then no scaling is done,0 1.3,,,
COMPASS_OPTIONS,This sets options to change the behaviour of the compass,,,,
COMPASS_DEV_ID4,"Extra 4th compass's device id.  Automatically detected, do not set manually",,,,True
COMPASS_DEV_ID5,"Extra 5th compass's device id.  Automatically detected, do not set manually",,,,True
COMPASS_DEV_ID6,"Extra 6th compass's device id.  Automatically detected, do not set manually",,,,True
COMPASS_DEV_ID7,"Extra 7th compass's device id.  Automatically detected, do not set manually",,,,True
COMPASS_DEV_ID8,"Extra 8th compass's device id.  Automatically detected, do not set manually",,,,True
COMPASS_CUS_ROLL,"Compass mounting position roll offset. Positive values = roll right, negative values = roll left. This parameter is only used when COMPASS_ORIENT/2/3 is set to CUSTOM.",-180 180,1,,
COMPASS_CUS_PIT,"Compass mounting position pitch offset. Positive values = pitch up, negative values = pitch down. This parameter is only used when COMPASS_ORIENT/2/3 is set to CUSTOM.",-180 180,1,,
COMPASS_CUS_YAW,"Compass mounting position yaw offset. Positive values = yaw right, negative values = yaw left. This parameter is only used when COMPASS_ORIENT/2/3 is set to CUSTOM.",-180 180,1,,
COMPASS_PMOT_EN,This enables per-motor compass corrections,,,0|1|,
COMPASS_PMOT_EXP,This is the exponential correction for the power output of the motor for per-motor compass correction,0 2,0.01,,
COMPASS_PMOT1_X,Compensation for X axis of motor1,,,,
COMPASS_PMOT1_Y,Compensation for Y axis of motor1,,,,
COMPASS_PMOT1_Z,Compensation for Z axis of motor1,,,,
COMPASS_PMOT2_X,Compensation for X axis of motor2,,,,
COMPASS_PMOT2_Y,Compensation for Y axis of motor2,,,,
COMPASS_PMOT2_Z,Compensation for Z axis of motor2,,,,
COMPASS_PMOT3_X,Compensation for X axis of motor3,,,,
COMPASS_PMOT3_Y,Compensation for Y axis of motor3,,,,
COMPASS_PMOT3_Z,Compensation for Z axis of motor3,,,,
COMPASS_PMOT4_X,Compensation for X axis of motor4,,,,
COMPASS_PMOT4_Y,Compensation for Y axis of motor4,,,,
COMPASS_PMOT4_Z,Compensation for Z axis of motor4,,,,
CUST_ROT_ENABLE,This enables custom rotations,,,0|1|,
CUST_ROT1_ROLL,"Custom euler roll, euler 321 (yaw, pitch, roll) ordering",,,,
CUST_ROT1_PITCH,"Custom euler pitch, euler 321 (yaw, pitch, roll) ordering",,,,
CUST_ROT1_YAW,"Custom euler yaw, euler 321 (yaw, pitch, roll) ordering",,,,
CUST_ROT2_ROLL,"Custom euler roll, euler 321 (yaw, pitch, roll) ordering",,,,
CUST_ROT2_PITCH,"Custom euler pitch, euler 321 (yaw, pitch, roll) ordering",,,,
CUST_ROT2_YAW,"Custom euler yaw, euler 321 (yaw, pitch, roll) ordering",,,,
EAHRS_TYPE,Type of AHRS device,,,0|1|2|,
EAHRS_RATE,Requested rate for AHRS device,,,,
EFI_TYPE,What method of communication is used for EFI #1,,,0|1|2|3|,
EFI_COEF1,Used to calibrate fuel flow for MS protocol (Slope),0 1,,,
EFI_COEF2,Used to calibrate fuel flow for MS protocol (Offset),0 10,,,
FFT_ENABLE,Enable Gyro FFT analyser,,,0|1|,
FFT_MINHZ,Lower bound of FFT frequency detection in Hz. On larger vehicles the minimum motor frequency is likely to be significantly lower than for smaller vehicles.,20 400,,,
FFT_MAXHZ,Upper bound of FFT frequency detection in Hz. On smaller vehicles the maximum motor frequency is likely to be significantly higher than for larger vehicles.,20 495,,,
FFT_SAMPLE_MODE,"Sampling mode (and therefore rate). 0: Gyro rate sampling, 1: Fast loop rate sampling, 2: Fast loop rate / 2 sampling, 3: Fast loop rate / 3 sampling. Takes effect on reboot.",0 4,,,
FFT_WINDOW_SIZE,"Size of window to be used in FFT calculations. Takes effect on reboot. Must be a power of 2 and between 32 and 512. Larger windows give greater frequency resolution but poorer time resolution, consume more CPU time and may not be appropriate for all vehicles. Time and frequency resolution are given by the sample-rate / window-size. Windows of 256 are only really recommended for F7 class boards, windows of 512 or more H7 class.",32 1024,,,
FFT_WINDOW_OLAP,Percentage of window to be overlapped before another frame is process. Takes effect on reboot. A good default is 50% overlap. Higher overlap results in more processed frames but not necessarily more temporal resolution. Lower overlap results in lost information at the frame edges.,0 0.9,,,
FFT_FREQ_HOVER,The learned hover noise frequency,0 250,,,
FFT_THR_REF,FFT learned thrust reference for the hover frequency and FFT minimum frequency.,0.01 0.9,,,
FFT_SNR_REF,FFT SNR reference threshold in dB at which a signal is determined to be present.,0.0 100.0,,,
FFT_ATT_REF,FFT attenuation level in dB for bandwidth calculation and peak detection. The bandwidth is calculated by comparing peak power output with the attenuated version. The default of 15 has shown to be a good compromise in both simulations and real flight.,0 100,,,
FFT_BW_HOVER,FFT learned bandwidth at hover for the attenuation frequencies.,0 200,,,
FFT_HMNC_FIT,FFT harmonic fit frequency threshold percentage at which a signal of the appropriate frequency is determined to be the harmonic of another. Signals that have a harmonic relationship that varies at most by this percentage are considered harmonics of each other for the purpose of selecting the harmonic notch frequency. If a match is found then the lower frequency harmonic is always used as the basis for the dynamic harmonic notch. A value of zero completely disables harmonic matching.,0 100,,,
FFT_HMNC_PEAK,The FFT harmonic peak target that should be returned by FTN1.PkAvg. The resulting value will be used by the harmonic notch if configured to track the FFT frequency. By default the appropriate peak is auto-detected based on the harmonic fit between peaks and the energy-weighted average frequency on roll on pitch is used. Setting this to 1 will always target the highest energy peak. Setting this to 2 will target the highest energy peak that is lower in frequency than the highest energy peak. Setting this to 3 will target the highest energy peak that is higher in frequency than the highest energy peak. Setting this to 4 will target the highest energy peak on the roll axis only and only the roll frequency will be used (some vehicles have a much more pronounced peak on roll). Setting this to 5 will target the highest energy peak on the pitch axis only and only the pitch frequency will be used (some vehicles have a much more pronounced peak on roll).,,,0|1|2|3|4|5|,
FRSKY_UPLINK_ID,Change the uplink sensor id (SPort only),,,-1|7|8|9|10|11|12|13|14|15|16|17|18|19|20|21|22|23|24|25|26|,
FRSKY_DNLINK1_ID,Change the first extra downlink sensor id (SPort only),,,-1|7|8|9|10|11|12|13|14|15|16|17|18|19|20|21|22|23|24|25|26|,
FRSKY_DNLINK2_ID,Change the second extra downlink sensor id (SPort only),,,-1|7|8|9|10|11|12|13|14|15|16|17|18|19|20|21|22|23|24|25|26|,
FRSKY_DNLINK_ID,Change the default downlink sensor id (SPort only),,,-1|7|8|9|10|11|12|13|14|15|16|17|18|19|20|21|22|23|24|25|26|27|,
FRSKY_OPTIONS,A bitmask to set some FRSky Telemetry specific options,,,,
GEN_TYPE,Generator type,,,0|1|2|3|,
GPS_TYPE,GPS type of 1st GPS,,,0|1|2|5|6|7|8|9|10|11|13|14|15|16|17|18|19|20|21|22|23|,
GPS_TYPE2,GPS type of 2nd GPS,,,0|1|2|5|6|7|8|9|10|11|13|14|15|16|17|18|19|20|21|22|23|,
GPS_NAVFILTER,Navigation filter engine setting,,,0|2|3|4|5|6|7|8|,
GPS_AUTO_SWITCH,"Automatic switchover to GPS reporting best lock, 1:UseBest selects the GPS with highest status, if both are equal the GPS with highest satellite count is used 4:Use primary if 3D fix or better, will revert to 'UseBest' behaviour if 3D fix is lost on primary",,,0|1|2|4|,
GPS_MIN_DGPS,Sets the minimum type of differential GPS corrections required before allowing to switch into DGPS mode.,,,0|50|100|,
GPS_SBAS_MODE,This sets the SBAS (satellite based augmentation system) mode if available on this GPS. If set to 2 then the SBAS mode is not changed in the GPS. Otherwise the GPS will be reconfigured to enable/disable SBAS. Disabling SBAS may be worthwhile in some parts of the world where an SBAS signal is available but the baseline is too long to be useful.,,,0|1|2|,
GPS_MIN_ELEV,This sets the minimum elevation of satellites above the horizon for them to be used for navigation. Setting this to -100 leaves the minimum elevation set to the GPS modules default.,-100 90,,,
GPS_INJECT_TO,The GGS can send raw serial packets to inject data to multiple GPSes.,,,0|1|127|,
GPS_SBP_LOGMASK,Masked with the SBP msg_type field to determine whether SBR1/SBR2 data is logged,,,0|-1|-256|,
GPS_RAW_DATA,"Handles logging raw data; on uBlox chips that support raw data this will log RXM messages into logger; on Septentrio this will log on the equipment's SD card and when set to 2, the autopilot will try to stop logging after disarming and restart after arming",,,0|1|2|5|,
GPS_GNSS_MODE,Bitmask for what GNSS system to use on the first GPS (all unchecked or zero to leave GPS as configured),,,,
GPS_SAVE_CFG,Determines whether the configuration for this GPS should be written to non-volatile memory on the GPS. Currently working for UBlox 6 series and above.,,,0|1|2|,
GPS_GNSS_MODE2,Bitmask for what GNSS system to use on the second GPS (all unchecked or zero to leave GPS as configured),,,,
GPS_AUTO_CONFIG,Controls if the autopilot should automatically configure the GPS based on the parameters and default settings,,,0|1|2|,
GPS_RATE_MS,Controls how often the GPS should provide a position update. Lowering below 5Hz(default) is not allowed. Raising the rate above 5Hz usually provides little benefit and for some GPS (eg Ublox M9N) can severely impact performance.,50 200,,100|125|200|,
GPS_RATE_MS2,Controls how often the GPS should provide a position update. Lowering below 5Hz(default) is not allowed. Raising the rate above 5Hz usually provides little benefit and for some GPS (eg Ublox M9N) can severely impact performance.,50 200,,100|125|200|,
GPS_POS1_X,X position of the first GPS antenna in body frame. Positive X is forward of the origin. Use antenna phase centroid location if provided by the manufacturer.,-5 5,0.01,,
GPS_POS1_Y,Y position of the first GPS antenna in body frame. Positive Y is to the right of the origin. Use antenna phase centroid location if provided by the manufacturer.,-5 5,0.01,,
GPS_POS1_Z,Z position of the first GPS antenna in body frame. Positive Z is down from the origin. Use antenna phase centroid location if provided by the manufacturer.,-5 5,0.01,,
GPS_POS2_X,X position of the second GPS antenna in body frame. Positive X is forward of the origin. Use antenna phase centroid location if provided by the manufacturer.,-5 5,0.01,,
GPS_POS2_Y,Y position of the second GPS antenna in body frame. Positive Y is to the right of the origin. Use antenna phase centroid location if provided by the manufacturer.,-5 5,0.01,,
GPS_POS2_Z,Z position of the second GPS antenna in body frame. Positive Z is down from the origin. Use antenna phase centroid location if provided by the manufacturer.,-5 5,0.01,,
GPS_DELAY_MS,Controls the amount of GPS  measurement delay that the autopilot compensates for. Set to zero to use the default delay for the detected GPS type.,0 250,,,
GPS_DELAY_MS2,Controls the amount of GPS  measurement delay that the autopilot compensates for. Set to zero to use the default delay for the detected GPS type.,0 250,,,
GPS_BLEND_MASK,"Determines which of the accuracy measures Horizontal position, Vertical Position and Speed are used to calculate the weighting on each GPS receiver when soft switching has been selected by setting GPS_AUTO_SWITCH to 2(Blend)",,,,
GPS_BLEND_TC,Controls the slowest time constant applied to the calculation of GPS position and height offsets used to adjust different GPS receivers for steady state position differences.,5.0 30.0,,,
GPS_DRV_OPTIONS,Additional backend specific options,,,,
GPS_COM_PORT,"The physical COM port on the connected device, currently only applies to SBF GPS",0 10,1,,
GPS_COM_PORT2,"The physical COM port on the connected device, currently only applies to SBF GPS",0 10,1,,
GPS_PRIMARY,This GPS will be used when GPS_AUTO_SWITCH is 0 and used preferentially with GPS_AUTO_SWITCH = 4.,,1,0|1|,
GPS_CAN_NODEID1,GPS Node id for first-discovered GPS.,,,,True
GPS_CAN_NODEID2,GPS Node id for second-discovered GPS.,,,,True
GPS1_CAN_OVRIDE,GPS Node id for first GPS. If 0 the gps will be automatically selected on a first-come-first-GPS basis.,,,,
GPS2_CAN_OVRIDE,GPS Node id for second GPS. If 0 the gps will be automatically selected on a second-come-second-GPS basis.,,,,
GPS_MB1_TYPE,Controls the type of moving base used if using moving base.,,,0|1|,
GPS_MB1_OFS_X,X position of the base GPS antenna in body frame. Positive X is forward of the origin. Use antenna phase centroid location if provided by the manufacturer.,-5 5,0.01,,
GPS_MB1_OFS_Y,Y position of the base GPS antenna in body frame. Positive Y is to the right of the origin. Use antenna phase centroid location if provided by the manufacturer.,-5 5,0.01,,
GPS_MB1_OFS_Z,Z position of the base GPS antenna in body frame. Positive Z is down from the origin. Use antenna phase centroid location if provided by the manufacturer.,-5 5,0.01,,
GPS_MB2_TYPE,Controls the type of moving base used if using moving base.,,,0|1|,
GPS_MB2_OFS_X,X position of the base GPS antenna in body frame. Positive X is forward of the origin. Use antenna phase centroid location if provided by the manufacturer.,-5 5,0.01,,
GPS_MB2_OFS_Y,Y position of the base GPS antenna in body frame. Positive Y is to the right of the origin. Use antenna phase centroid location if provided by the manufacturer.,-5 5,0.01,,
GPS_MB2_OFS_Z,Z position of the base GPS antenna in body frame. Positive Z is down from the origin. Use antenna phase centroid location if provided by the manufacturer.,-5 5,0.01,,
INS_GYROFFS_X,Gyro sensor offsets of X axis. This is setup on each boot during gyro calibrations,,,,
INS_GYROFFS_Y,Gyro sensor offsets of Y axis. This is setup on each boot during gyro calibrations,,,,
INS_GYROFFS_Z,Gyro sensor offsets of Z axis. This is setup on each boot during gyro calibrations,,,,
INS_GYR2OFFS_X,Gyro2 sensor offsets of X axis. This is setup on each boot during gyro calibrations,,,,
INS_GYR2OFFS_Y,Gyro2 sensor offsets of Y axis. This is setup on each boot during gyro calibrations,,,,
INS_GYR2OFFS_Z,Gyro2 sensor offsets of Z axis. This is setup on each boot during gyro calibrations,,,,
INS_GYR3OFFS_X,Gyro3 sensor offsets of X axis. This is setup on each boot during gyro calibrations,,,,
INS_GYR3OFFS_Y,Gyro3 sensor offsets of Y axis. This is setup on each boot during gyro calibrations,,,,
INS_GYR3OFFS_Z,Gyro3 sensor offsets of Z axis. This is setup on each boot during gyro calibrations,,,,
INS_ACCSCAL_X,Accelerometer scaling of X axis.  Calculated during acceleration calibration routine,0.8 1.2,,,
INS_ACCSCAL_Y,Accelerometer scaling of Y axis  Calculated during acceleration calibration routine,0.8 1.2,,,
INS_ACCSCAL_Z,Accelerometer scaling of Z axis  Calculated during acceleration calibration routine,0.8 1.2,,,
INS_ACCOFFS_X,Accelerometer offsets of X axis. This is setup using the acceleration calibration or level operations,-3.5 3.5,,,
INS_ACCOFFS_Y,Accelerometer offsets of Y axis. This is setup using the acceleration calibration or level operations,-3.5 3.5,,,
INS_ACCOFFS_Z,Accelerometer offsets of Z axis. This is setup using the acceleration calibration or level operations,-3.5 3.5,,,
INS_ACC2SCAL_X,Accelerometer2 scaling of X axis.  Calculated during acceleration calibration routine,0.8 1.2,,,
INS_ACC2SCAL_Y,Accelerometer2 scaling of Y axis  Calculated during acceleration calibration routine,0.8 1.2,,,
INS_ACC2SCAL_Z,Accelerometer2 scaling of Z axis  Calculated during acceleration calibration routine,0.8 1.2,,,
INS_ACC2OFFS_X,Accelerometer2 offsets of X axis. This is setup using the acceleration calibration or level operations,-3.5 3.5,,,
INS_ACC2OFFS_Y,Accelerometer2 offsets of Y axis. This is setup using the acceleration calibration or level operations,-3.5 3.5,,,
INS_ACC2OFFS_Z,Accelerometer2 offsets of Z axis. This is setup using the acceleration calibration or level operations,-3.5 3.5,,,
INS_ACC3SCAL_X,Accelerometer3 scaling of X axis.  Calculated during acceleration calibration routine,0.8 1.2,,,
INS_ACC3SCAL_Y,Accelerometer3 scaling of Y axis  Calculated during acceleration calibration routine,0.8 1.2,,,
INS_ACC3SCAL_Z,Accelerometer3 scaling of Z axis  Calculated during acceleration calibration routine,0.8 1.2,,,
INS_ACC3OFFS_X,Accelerometer3 offsets of X axis. This is setup using the acceleration calibration or level operations,-3.5 3.5,,,
INS_ACC3OFFS_Y,Accelerometer3 offsets of Y axis. This is setup using the acceleration calibration or level operations,-3.5 3.5,,,
INS_ACC3OFFS_Z,Accelerometer3 offsets of Z axis. This is setup using the acceleration calibration or level operations,-3.5 3.5,,,
INS_GYRO_FILTER,Filter cutoff frequency for gyroscopes. This can be set to a lower value to try to cope with very high vibration levels in aircraft. A value of zero means no filtering (not recommended!),0 256,,,
INS_ACCEL_FILTER,Filter cutoff frequency for accelerometers. This can be set to a lower value to try to cope with very high vibration levels in aircraft. A value of zero means no filtering (not recommended!),0 256,,,
INS_USE,"Use first IMU for attitude, velocity and position estimates",,,0|1|,
INS_USE2,"Use second IMU for attitude, velocity and position estimates",,,0|1|,
INS_USE3,"Use third IMU for attitude, velocity and position estimates",,,0|1|,
INS_STILL_THRESH,"Threshold to tolerate vibration to determine if vehicle is motionless. This depends on the frame type and if there is a constant vibration due to motors before launch or after landing. Total motionless is about 0.05. Suggested values: Planes/rover use 0.1, multirotors use 1, tradHeli uses 5",0.05 50,,,
INS_GYR_CAL,Conrols when automatic gyro calibration is performed,,,0|1|,
INS_TRIM_OPTION,Specifies how the accel cal routine determines the trims,,,0|1|2|,
INS_ACC_BODYFIX,The body-fixed accelerometer to be used for trim calculation,,,1|2|3|,
INS_POS1_X,"X position of the first IMU Accelerometer in body frame. Positive X is forward of the origin. Attention: The IMU should be located as close to the vehicle c.g. as practical so that the value of this parameter is minimised. Failure to do so can result in noisy navigation velocity measurements due to vibration and IMU gyro noise. If the IMU cannot be moved and velocity noise is a problem, a location closer to the IMU can be used as the body frame origin.",-5 5,0.01,,
INS_POS1_Y,"Y position of the first IMU accelerometer in body frame. Positive Y is to the right of the origin. Attention: The IMU should be located as close to the vehicle c.g. as practical so that the value of this parameter is minimised. Failure to do so can result in noisy navigation velocity measurements due to vibration and IMU gyro noise. If the IMU cannot be moved and velocity noise is a problem, a location closer to the IMU can be used as the body frame origin.",-5 5,0.01,,
