Name,Description,Range,Increment,Value,Read_only
SURFACE_DEPTH,The depth the external pressure sensor will read when the vehicle is considered at the surface (in centimeters),-100 0,,,
FORMAT_VERSION,This value is incremented when changes are made to the eeprom format,,,,True
SYSID_THISMAV,Allows setting an individual MAVLink system id for this vehicle to distinguish it from others on the same network,1 255,,,
SYSID_MYGCS,Allows restricting radio overrides to only come from my ground station,,,,
PILOT_THR_FILT,Throttle filter cutoff (Hz) - active whenever altitude control is inactive - 0 to disable,0 10,.5,,
GCS_PID_MASK,bitmask of PIDs to send MAVLink PID_TUNING messages for,,,0|1|2|4|,
RNGFND_GAIN,Used to adjust the speed with which the target altitude is changed when objects are sensed below the sub,0.01 2.0,0.01,,
FS_GCS_ENABLE,Controls what action to take when GCS heartbeat is lost.,,,0|1|2|3|4|,
FS_LEAK_ENABLE,Controls what action to take if a leak is detected.,,,0|1|2|,
FS_PRESS_ENABLE,Controls what action to take if internal pressure exceeds FS_PRESS_MAX parameter.,,,0|1|,
FS_TEMP_ENABLE,Controls what action to take if internal temperature exceeds FS_TEMP_MAX parameter.,,,0|1|,
FS_PRESS_MAX,The maximum internal pressure allowed before triggering failsafe. Failsafe action is determined by FS_PRESS_ENABLE parameter,,,,
FS_TEMP_MAX,The maximum internal temperature allowed before triggering failsafe. Failsafe action is determined by FS_TEMP_ENABLE parameter.,,,,
FS_TERRAIN_ENAB,Controls what action to take if terrain information is lost during AUTO mode,,,0|1|2|,
FS_PILOT_INPUT,Controls what action to take if no pilot input has been received after the timeout period specified by the FS_PILOT_TIMEOUT parameter,,,0|1|2|,
FS_PILOT_TIMEOUT,Controls the maximum interval between received pilot inputs before the failsafe action is triggered,0.1 3.0,,,
XTRACK_ANG_LIM,Maximum allowed angle (in degrees) between current track and desired heading during waypoint navigation,10 90,,,
WP_YAW_BEHAVIOR,Determines how the autopilot controls the yaw during missions and RTL,,,0|1|2|3|4|,
PILOT_SPEED_UP,The maximum vertical ascending velocity the pilot may request in cm/s,50 500,10,,
PILOT_SPEED_DN,The maximum vertical descending velocity the pilot may request in cm/s,50 500,10,,
PILOT_ACCEL_Z,The vertical acceleration used when pilot is controlling the altitude,50 500,10,,
THR_DZ,"The PWM deadzone in microseconds above and below mid throttle. Used in AltHold, Loiter, PosHold flight modes",0 300,1,,
LOG_BITMASK,4 byte bitmap of log types to enable,,,830|894|958|1854|-6146|45054|131071|262142|393214|397310|655358|0|,
ANGLE_MAX,Maximum lean angle in all flight modes,1000 8000,10,,
FS_EKF_ACTION,Controls the action that will be taken when an EKF failsafe is invoked,,,0|1|2|,
FS_EKF_THRESH,Allows setting the maximum acceptable compass and velocity variance,,,0.6|0.8|1.0|,
FS_CRASH_CHECK,This enables automatic crash checking. When enabled the motors will disarm if a crash is detected.,,,0|1|2|,
JS_GAIN_DEFAULT,"Default gain at boot, must be in range [JS_GAIN_MIN , JS_GAIN_MAX]",0.1 1.0,,,
JS_GAIN_MAX,Maximum joystick gain,0.2 1.0,,,
JS_GAIN_MIN,Minimum joystick gain,0.1 0.8,,,
JS_GAIN_STEPS,Controls the number of steps between minimum and maximum joystick gain when the gain is adjusted using buttons. Set to 1 to always use JS_GAIN_DEFAULT.,1 10,,,
JS_LIGHTS_STEPS,Number of steps in brightness between minimum and maximum brightness,1 10,,,
JS_THR_GAIN,Scalar for gain on the throttle channel,0.5 4.0,,,
FRAME_CONFIG,Set this parameter according to your vehicle/motor configuration,,,0|1|2|3|4|5|6|7|,
RC_SPEED,This is the speed in Hertz that your ESCs will receive updates,50 490,1,,
ACRO_RP_P,Converts pilot roll and pitch into a desired rate of rotation in ACRO and SPORT mode.  Higher values mean faster rate of rotation.,1 10,,,
ACRO_YAW_P,Converts pilot yaw input into a desired rate of rotation.  Higher values mean faster rate of rotation.,1 10,,,
ACRO_BAL_ROLL,rate at which roll angle returns to level in acro mode.  A higher value causes the vehicle to return to level faster.,0 3,0.1,,
ACRO_BAL_PITCH,rate at which pitch angle returns to level in acro mode.  A higher value causes the vehicle to return to level faster.,0 3,0.1,,
ACRO_TRAINER,Type of trainer used in acro mode,,,0|1|2|,
ACRO_EXPO,Acro roll/pitch Expo to allow faster rotation when stick at edges,,,0|0.1|0.2|0.3|0.4|0.5|,
AHRS_GPS_GAIN,This controls how much to use the GPS to correct the attitude. This should never be set to zero for a plane as it would result in the plane losing control in turns. For a plane please use the default value of 1.0.,0.0 1.0,.01,,
AHRS_GPS_USE,"This controls whether to use dead-reckoning or GPS based navigation. If set to 0 then the GPS won't be used for navigation, and only dead reckoning will be used. A value of zero should never be used for normal flight. Currently this affects only the DCM-based AHRS: the EKF uses GPS according to its own parameters. A value of 2 means to use GPS for height as well as position - both in DCM estimation and when determining altitude-above-home.",,,0|1|2|,
AHRS_YAW_P,This controls the weight the compass or GPS has on the heading. A higher value means the heading will track the yaw source (GPS or compass) more rapidly.,0.1 0.4,.01,,
AHRS_RP_P,This controls how fast the accelerometers correct the attitude,0.1 0.4,.01,,
AHRS_WIND_MAX,This sets the maximum allowable difference between ground speed and airspeed. This allows the plane to cope with a failing airspeed sensor. A value of zero means to use the airspeed as is. See ARSPD_OPTIONS and ARSPD_MAX_WIND to disable airspeed sensors.,0 127,1,,
AHRS_TRIM_X,Compensates for the roll angle difference between the control board and the frame. Positive values make the vehicle roll right.,-0.1745 +0.1745,0.01,,
AHRS_TRIM_Y,Compensates for the pitch angle difference between the control board and the frame. Positive values make the vehicle pitch up/back.,-0.1745 +0.1745,0.01,,
AHRS_TRIM_Z,Not Used,-0.1745 +0.1745,0.01,,
AHRS_ORIENTATION,Overall board orientation relative to the standard orientation for the board type. This rotates the IMU and compass readings to allow the board to be oriented in your vehicle at any 90 or 45 degree angle. The label for each option is specified in the order of rotations for that orientation. This option takes affect on next boot. After changing you will need to re-level your vehicle.,,,0|1|2|3|4|5|6|7|8|9|10|11|12|13|14|15|16|17|18|19|20|21|22|23|24|25|26|27|28|29|30|31|32|33|34|35|36|37|38|39|40|42|43|100|101|102|,
AHRS_COMP_BETA,This controls the time constant for the cross-over frequency used to fuse AHRS (airspeed and heading) and GPS data to estimate ground velocity. Time constant is 0.1/beta. A larger time constant will use GPS data less and a small time constant will use air data less.,0.001 0.5,.01,,
AHRS_GPS_MINSATS,"Minimum number of satellites visible to use GPS for velocity based corrections attitude correction. This defaults to 6, which is about the point at which the velocity numbers from a GPS become too unreliable for accurate correction of the accelerometers.",0 10,1,,
AHRS_EKF_TYPE,This controls which NavEKF Kalman filter version is used for attitude and position estimation,,,0|2|3|11|,
AHRS_CUSTOM_ROLL,"Autopilot mounting position roll offset. Positive values = roll right, negative values = roll left. This parameter is only used when AHRS_ORIENTATION is set to CUSTOM.",-180 180,1,,
AHRS_CUSTOM_PIT,"Autopilot mounting position pitch offset. Positive values = pitch up, negative values = pitch down. This parameter is only used when AHRS_ORIENTATION is set to CUSTOM.",-180 180,1,,
AHRS_CUSTOM_YAW,"Autopilot mounting position yaw offset. Positive values = yaw right, negative values = yaw left. This parameter is only used when AHRS_ORIENTATION is set to CUSTOM.",-180 180,1,,
ARMING_ACCTHRESH,Accelerometer error threshold used to determine inconsistent accelerometers. Compares this error range to other accelerometers to detect a hardware or calibration error. Lower value means tighter check and harder to pass arming check. Not all accelerometers are created equal.,0.25 3.0,,,
ARMING_RUDDER,"Allow arm/disarm by rudder input. When enabled arming can be done with right rudder, disarming with left rudder. Rudder arming only works in manual throttle modes with throttle at zero +- deadzone (RCx_DZ)",,,0|1|2|,
ARMING_MIS_ITEMS,Bitmask of mission items that are required to be planned in order to arm the aircraft,,,,
ARMING_CHECK,"Checks prior to arming motor. This is a bitmask of checks that will be performed before allowing arming. For most users it is recommended to leave this at the default of 1 (all checks enabled). You can select whatever checks you prefer by adding together the values of each check type to set this parameter. For example, to only allow arming when you have GPS lock and no RC failsafe you would set ARMING_CHECK to 72.",,,,
ARSPD_TYPE,Type of airspeed sensor,,,0|1|2|3|4|5|6|7|8|9|10|11|12|13|14|15|,
ARSPD_DEVID,"Airspeed sensor ID, taking into account its type, bus and instance",,,,True
ARSPD_USE,Enables airspeed use for automatic throttle modes and replaces control from THR_TRIM. Continues to display and log airspeed if set to 0. Uses airspeed for control if set to 1. Only uses airspeed when throttle = 0 if set to 2 (useful for gliders with airspeed sensors behind propellers).,,,0|1|2|,
ARSPD_OFFSET,Airspeed calibration offset,,0.1,,
ARSPD_RATIO,Calibrates pitot tube pressure to velocity. Increasing this value will indicate a higher airspeed at any given dynamic pressure.,,0.1,,
ARSPD_PIN,The pin number that the airspeed sensor is connected to for analog sensors. Set to 15 on the Pixhawk for the analog airspeed port. ,,,,
ARSPD_AUTOCAL,Enables automatic adjustment of ARSPD_RATIO during a calibration flight based on estimation of ground speed and true airspeed. New ratio saved every 2 minutes if change is > 5%. Should not be left enabled.,,,,
ARSPD_TUBE_ORDER,"This parameter allows you to control whether the order in which the tubes are attached to your pitot tube matters. If you set this to 0 then the first (often the top) connector on the sensor needs to be the stagnation pressure (the pressure at the tip of the pitot tube). If set to 1 then the second (often the bottom) connector needs to be the stagnation pressure. If set to 2 (the default) then the airspeed driver will accept either order. The reason you may wish to specify the order is it will allow your airspeed sensor to detect if the aircraft is receiving excessive pressure on the static port compared to the stagnation port such as during a stall, which would otherwise be seen as a positive airspeed.",,,0|1|2|,
ARSPD_SKIP_CAL,"This parameter allows you to skip airspeed offset calibration on startup, instead using the offset from the last calibration. This may be desirable if the offset variance between flights for your sensor is low and you want to avoid having to cover the pitot tube on each boot.",,,0|1|,
ARSPD_PSI_RANGE,This parameter allows you to to set the PSI (pounds per square inch) range for your sensor. You should not change this unless you examine the datasheet for your device,,,,
ARSPD_BUS,Bus number of the I2C bus where the airspeed sensor is connected,,,0|1|2|,
ARSPD_PRIMARY,This selects which airspeed sensor will be the primary if multiple sensors are found,,,0|1|,
ARSPD_OPTIONS,"Bitmask of options to use with airspeed. 0:Disable use based on airspeed/groundspeed mismatch (see ARSPD_WIND_MAX), 1:Automatically reenable use based on airspeed/groundspeed mismatch recovery (see ARSPD_WIND_MAX) 2:Disable voltage correction",,,,
ARSPD_WIND_MAX,If the difference between airspeed and ground speed is greater than this value the sensor will be marked unhealthy. Using ARSPD_OPTION this health value can be used to disable the sensor.,,,,
ARSPD_WIND_WARN,If the difference between airspeed and ground speed is greater than this value the sensor will issue a warning. If 0 ARSPD_WIND_MAX is used.,,,,
ARSPD2_TYPE,Type of 2nd airspeed sensor,,,0|1|2|3|4|5|6|7|8|9|10|11|12|13|14|15|,
ARSPD2_USE,"use airspeed for flight control. When set to 0 airspeed sensor can be logged and displayed on a GCS but won't be used for flight. When set to 1 it will be logged and used. When set to 2 it will be only used when the throttle is zero, which can be useful in gliders with airspeed sensors behind a propeller",,,0|1|2|,
ARSPD2_OFFSET,Airspeed calibration offset,,0.1,,
ARSPD2_RATIO,Airspeed calibration ratio,,0.1,,
ARSPD2_PIN,Pin number indicating location of analog airspeed sensors. Pixhawk/Cube if set to 15. ,,,,
ARSPD2_AUTOCAL,"If this is enabled then the autopilot will automatically adjust the ARSPD_RATIO during flight, based upon an estimation filter using ground speed and true airspeed. The automatic calibration will save the new ratio to EEPROM every 2 minutes if it changes by more than 5%. This option should be enabled for a calibration flight then disabled again when calibration is complete. Leaving it enabled all the time is not recommended.",,,,
ARSPD2_TUBE_ORDR,"This parameter allows you to control whether the order in which the tubes are attached to your pitot tube matters. If you set this to 0 then the first (often the top) connector on the sensor needs to be the stagnation pressure (the pressure at the tip of the pitot tube). If set to 1 then the second (often the bottom) connector needs to be the stagnation pressure. If set to 2 (the default) then the airspeed driver will accept either order. The reason you may wish to specify the order is it will allow your airspeed sensor to detect if the aircraft is receiving excessive pressure on the static port compared to the stagnation port such as during a stall, which would otherwise be seen as a positive airspeed.",,,0|1|2|,
ARSPD2_SKIP_CAL,"This parameter allows you to skip airspeed offset calibration on startup, instead using the offset from the last calibration. This may be desirable if the offset variance between flights for your sensor is low and you want to avoid having to cover the pitot tube on each boot.",,,0|1|,
ARSPD2_PSI_RANGE,This parameter allows you to to set the PSI (pounds per square inch) range for your sensor. You should not change this unless you examine the datasheet for your device,,,,
ARSPD2_BUS,The bus number of the I2C bus to look for the sensor on,,,0|1|2|,
ARSPD2_DEVID,"Airspeed2 sensor ID, taking into account its type, bus and instance",,,,True
ATC_SLEW_YAW,"Maximum rate the yaw target can be updated in Loiter, RTL, Auto flight modes",500 18000,100,,
ATC_ACCEL_Y_MAX,Maximum acceleration in yaw axis,0 72000,1000,0|9000|18000|36000|54000|,
ATC_RATE_FF_ENAB,Controls whether body-frame rate feedfoward is enabled or disabled,,,0|1|,
ATC_ACCEL_R_MAX,Maximum acceleration in roll axis,0 180000,1000,0|30000|72000|108000|162000|,
ATC_ACCEL_P_MAX,Maximum acceleration in pitch axis,0 180000,1000,0|30000|72000|108000|162000|,
ATC_ANGLE_BOOST,Angle Boost increases output throttle as the vehicle leans to reduce loss of altitude,,,0|1|,
ATC_ANG_RLL_P,Roll axis angle controller P gain.  Converts the error between the desired roll angle and actual angle to a desired roll rate,0.0 12.000,,,
ATC_ANG_PIT_P,Pitch axis angle controller P gain.  Converts the error between the desired pitch angle and actual angle to a desired pitch rate,0.0 12.000,,,
ATC_ANG_YAW_P,Yaw axis angle controller P gain.  Converts the error between the desired yaw angle and actual angle to a desired yaw rate,0.0 6.000,,,
ATC_ANG_LIM_TC,Angle Limit (to maintain altitude) Time Constant,0.5 10.0,,,
ATC_RATE_R_MAX,Maximum angular velocity in roll axis,0 1080,1,0|60|180|360|,
ATC_RATE_P_MAX,Maximum angular velocity in pitch axis,0 1080,1,0|60|180|360|,
ATC_RATE_Y_MAX,Maximum angular velocity in yaw axis,0 1080,1,0|60|180|360|,
ATC_INPUT_TC,"Attitude control input time constant.  Low numbers lead to sharper response, higher numbers to softer response",0 1,0.01,0.5|0.2|0.15|0.1|0.05|,
ATC_RAT_RLL_P,Roll axis rate controller P gain.  Converts the difference between desired roll rate and actual roll rate into a motor speed output,0.0 0.30,0.005,,
ATC_RAT_RLL_I,Roll axis rate controller I gain.  Corrects long-term difference in desired roll rate vs actual roll rate,0.0 0.5,0.01,,
ATC_RAT_RLL_IMAX,Roll axis rate controller I gain maximum.  Constrains the maximum motor output that the I gain will output,0 1,0.01,,
ATC_RAT_RLL_D,Roll axis rate controller D gain.  Compensates for short-term change in desired roll rate vs actual roll rate,0.0 0.02,0.001,,
ATC_RAT_RLL_FF,Roll axis rate controller feed forward,0 0.5,0.001,,
ATC_RAT_RLL_FLTT,Roll axis rate controller input frequency in Hz,1 100,1,,
ATC_RAT_RLL_FLTE,Roll axis rate controller input frequency in Hz,1 100,1,,
ATC_RAT_RLL_FLTD,Roll axis rate controller input frequency in Hz,1 100,1,,
ATC_RAT_RLL_SMAX,"Sets an upper limit on the slew rate produced by the combined P and D gains. If the amplitude of the control action produced by the rate feedback exceeds this value, then the D+P gain is reduced to respect the limit. This limits the amplitude of high frequency oscillations caused by an excessive gain. The limit should be set to no more than 25% of the actuators maximum slew rate to allow for load effects. Note: The gain will not be reduced to less than 10% of the nominal value. A value of zero will disable this feature.",0 200,0.5,,
ATC_RAT_PIT_P,Pitch axis rate controller P gain.  Converts the difference between desired pitch rate and actual pitch rate into a motor speed output,0.0 0.30,0.005,,
ATC_RAT_PIT_I,Pitch axis rate controller I gain.  Corrects long-term difference in desired pitch rate vs actual pitch rate,0.0 0.5,0.01,,
ATC_RAT_PIT_IMAX,Pitch axis rate controller I gain maximum.  Constrains the maximum motor output that the I gain will output,0 1,0.01,,
ATC_RAT_PIT_D,Pitch axis rate controller D gain.  Compensates for short-term change in desired pitch rate vs actual pitch rate,0.0 0.02,0.001,,
ATC_RAT_PIT_FF,Pitch axis rate controller feed forward,0 0.5,0.001,,
ATC_RAT_PIT_FLTT,Pitch axis rate controller input frequency in Hz,1 100,1,,
ATC_RAT_PIT_FLTE,Pitch axis rate controller input frequency in Hz,1 100,1,,
ATC_RAT_PIT_FLTD,Pitch axis rate controller input frequency in Hz,1 100,1,,
ATC_RAT_PIT_SMAX,"Sets an upper limit on the slew rate produced by the combined P and D gains. If the amplitude of the control action produced by the rate feedback exceeds this value, then the D+P gain is reduced to respect the limit. This limits the amplitude of high frequency oscillations caused by an excessive gain. The limit should be set to no more than 25% of the actuators maximum slew rate to allow for load effects. Note: The gain will not be reduced to less than 10% of the nominal value. A value of zero will disable this feature.",0 200,0.5,,
ATC_RAT_YAW_P,Yaw axis rate controller P gain.  Converts the difference between desired yaw rate and actual yaw rate into a motor speed output,0.0 0.50,0.005,,
ATC_RAT_YAW_I,Yaw axis rate controller I gain.  Corrects long-term difference in desired yaw rate vs actual yaw rate,0.0 0.05,0.01,,
ATC_RAT_YAW_IMAX,Yaw axis rate controller I gain maximum.  Constrains the maximum motor output that the I gain will output,0 1,0.01,,
ATC_RAT_YAW_D,Yaw axis rate controller D gain.  Compensates for short-term change in desired yaw rate vs actual yaw rate,0.000 0.02,0.001,,
ATC_RAT_YAW_FF,Yaw axis rate controller feed forward,0 0.5,0.001,,
ATC_RAT_YAW_FLTT,Yaw axis rate controller input frequency in Hz,1 100,1,,
ATC_RAT_YAW_FLTE,Yaw axis rate controller input frequency in Hz,1 100,1,,
ATC_RAT_YAW_FLTD,Yaw axis rate controller input frequency in Hz,1 100,1,,
ATC_RAT_YAW_SMAX,"Sets an upper limit on the slew rate produced by the combined P and D gains. If the amplitude of the control action produced by the rate feedback exceeds this value, then the D+P gain is reduced to respect the limit. This limits the amplitude of high frequency oscillations caused by an excessive gain. The limit should be set to no more than 25% of the actuators maximum slew rate to allow for load effects. Note: The gain will not be reduced to less than 10% of the nominal value. A value of zero will disable this feature.",0 200,0.5,,
ATC_THR_MIX_MIN,Throttle vs attitude control prioritisation used when landing (higher values mean we prioritise attitude control over throttle),0.1 0.25,,,
ATC_THR_MIX_MAX,Throttle vs attitude control prioritisation used during active flight (higher values mean we prioritise attitude control over throttle),0.5 0.9,,,
ATC_THR_MIX_MAN,Throttle vs attitude control prioritisation used during manual flight (higher values mean we prioritise attitude control over throttle),0.5 0.9,,,
ATC_RAT_RLL_FILT,Roll axis rate controller input frequency in Hz,1 100,1,,
ATC_RAT_PIT_FILT,Pitch axis rate controller input frequency in Hz,1 100,1,,
ATC_RAT_YAW_FILT,Yaw axis rate controller input frequency in Hz,1 100,1,,
AVOID_ENABLE,Enabled/disable avoidance input sources,,,,
AVOID_MARGIN,Vehicle will attempt to stay at least this distance (in meters) from objects while in GPS modes,1 10,,,
AVOID_BACKUP_SPD,Maximum speed that will be used to back away from obstacles in GPS modes (m/s). Set zero to disable,0 2,,,
AVOID_ACCEL_MAX,Maximum acceleration with which obstacles will be avoided with. Set zero to disable acceleration limits,0 9,,,
AVOID_BACKUP_DZ,"Distance beyond AVOID_MARGIN parameter, after which vehicle will backaway from obstacles. Increase this parameter if you see vehicle going back and forth in front of obstacle.",0 2,,,
BARO1_GND_PRESS,calibrated ground pressure in Pascals,,1,,True
BARO_GND_TEMP,User provided ambient ground temperature in degrees Celsius. This is used to improve the calculation of the altitude the vehicle is at. This parameter is not persistent and will be reset to 0 every time the vehicle is rebooted. A value of 0 means use the internal measurement ambient temperature.,,1,,
BARO_ALT_OFFSET,altitude offset in meters added to barometric altitude. This is used to allow for automatic adjustment of the base barometric altitude by a ground station equipped with a barometer. The value is added to the barometric altitude read by the aircraft. It is automatically reset to 0 when the barometer is calibrated on each reboot or when a preflight calibration is performed.,,0.1,,
BARO_PRIMARY,This selects which barometer will be the primary if multiple barometers are found,,,0|1|2|,
BARO_EXT_BUS,This selects the bus number for looking for an I2C barometer. When set to -1 it will probe all external i2c buses based on the GND_PROBE_EXT parameter.,,,-1|0|1|,
BARO_SPEC_GRAV,This sets the specific gravity of the fluid when flying an underwater ROV.,,,1.0|1.024|,
BARO2_GND_PRESS,calibrated ground pressure in Pascals,,1,,True
BARO3_GND_PRESS,calibrated ground pressure in Pascals,,1,,True
BARO_FLTR_RNG,This sets the range around the average value that new samples must be within to be accepted. This can help reduce the impact of noise on sensors that are on long I2C cables. The value is a percentage from the average value. A value of zero disables this filter.,0 100,1,,
BARO_PROBE_EXT,"This sets which types of external i2c barometer to look for. It is a bitmask of barometer types. The I2C buses to probe is based on GND_EXT_BUS. If BARO_EXT_BUS is -1 then it will probe all external buses, otherwise it will probe just the bus number given in GND_EXT_BUS.",,,,
BARO1_DEVID,"Barometer sensor ID, taking into account its type, bus and instance",,,,True
BARO2_DEVID,"Barometer2 sensor ID, taking into account its type, bus and instance",,,,True
BARO3_DEVID,"Barometer3 sensor ID, taking into account its type, bus and instance",,,,True
BARO1_WCF_ENABLE,This enables the use of wind coefficients for barometer compensation,,,0|1|,
BARO1_WCF_FWD,"This is the ratio of static pressure error to dynamic pressure generated by a positive wind relative velocity along the X body axis. If the baro height estimate rises during forwards flight, then this will be a negative number. Multirotors can use this feature only if using EKF3 and if the EK3_BCOEF_X and EK3_BCOEF_Y parameters have been tuned.",-1.0 1.0,0.05,,
BARO1_WCF_BCK,"This is the ratio of static pressure error to dynamic pressure generated by a negative wind relative velocity along the X body axis. If the baro height estimate rises during backwards flight, then this will be a negative number. Multirotors can use this feature only if using EKF3 and if the EK3_BCOEF_X and EK3_BCOEF_Y parameters have been tuned.",-1.0 1.0,0.05,,
BARO1_WCF_RGT,"This is the ratio of static pressure error to dynamic pressure generated by a positive wind relative velocity along the Y body axis. If the baro height estimate rises during sideways flight to the right, then this should be a negative number. Multirotors can use this feature only if using EKF3 and if the EK3_BCOEF_X and EK3_BCOEF_Y parameters have been tuned.",-1.0 1.0,0.05,,
BARO1_WCF_LFT,"This is the ratio of static pressure error to dynamic pressure generated by a negative wind relative velocity along the Y body axis. If the baro height estimate rises during sideways flight to the left, then this should be a negative number. Multirotors can use this feature only if using EKF3 and if the EK3_BCOEF_X and EK3_BCOEF_Y parameters have been tuned.",-1.0 1.0,0.05,,
BARO2_WCF_ENABLE,This enables the use of wind coefficients for barometer compensation,,,0|1|,
